Symbol,Security Name
A,"Agilent Technologies, Inc. Common Stock"
AA,Alcoa Corporation Common Stock 
AADX,"Applied Aerospace & Defense, Inc. Common Stock"
AAMI,Acadian Asset Management Inc. Common Stock
AAT,"American Assets Trust, Inc. Common Stock"
ABBV,AbbVie Inc. Common Stock
ABCB,Ameris Bancorp Common Stock
ABG,Asbury Automotive Group Inc Common Stock
ABM,ABM Industries Incorporated Common Stock
ABR,Arbor Realty Trust Common Stock
ABT,Abbott Laboratories Common Stock
ABX,"Abacus Global Management, Inc. Class A Common Stock"
ACA,"Arcosa, Inc. Common Stock "
ACCO,Acco Brands Corporation Common Stock
ACH,"Accendra Health, Inc. Common Stock"
ACHR,Archer Aviation Inc. Class A Common Stock
ACI,"Albertsons Companies, Inc. Class A Common Stock"
ACM,AECOM Common Stock
ACR,ACRES Commercial Realty Corp. Common Stock
ACRE,Ares Commercial Real Estate Corporation Common Stock
ACVA,ACV Auctions Inc. Class A Common Stock
ADC,Agree Realty Corporation Common Stock
ADT,ADT Inc. Common Stock
AEE,Ameren Corporation Common Stock
AEM,Agnico Eagle Mines Limited Common Stock
AEO,"American Eagle Outfitters, Inc. Common Stock"
AES,The AES Corporation Common Stock
AESI,Atlas Energy Solutions Inc. Common Stock
AFG,"American Financial Group, Inc. Common Stock"
AFL,AFLAC Incorporated Common Stock
AGCO,AGCO Corporation Common Stock
AGL,"agilon health, inc. Common Stock"
AGM,Federal Agricultural Mortgage Corporation Common Stock
AGM-A,Federal Agricultural Mortgage Corporation Common Stock
AGO,Assured Guaranty Ltd. Common Stock
AGX,"Argan, Inc. Common Stock"
AHR,"American Healthcare REIT, Inc. Common Stock"
AHRT,"AH Realty Trust, Inc. Common Stock"
AHT,Ashford Hospitality Trust Inc Common Stock
AI,"C3.ai, Inc. Class A Common Stock"
AIG,"American International Group, Inc. New Common Stock"
AII,"American Integrity Insurance Group, Inc. Common Stock"
AIN,Albany International Corporation Common Stock
AIR,AAR Corp. Common Stock
AIT,"Applied Industrial Technologies, Inc. Common Stock"
AIV,Apartment Investment and Management Company Common Stock
AIZ,"Assurant, Inc. Common Stock"
AJG,Arthur J. Gallagher & Co. Common Stock
AKA,a.k.a. Brands Holding Corp. Common Stock
AKO-A,Embotelladora Andina S.A. Common Stock
AKO-B,Embotelladora Andina S.A. Common Stock
AKR,Acadia Realty Trust Common Stock
ALB,Albemarle Corporation Common Stock
ALG,"Alamo Group, Inc. Common Stock"
ALH,Alliance Laundry Holdings Inc. Common Stock
ALIT,"Alight, Inc. Class A Common Stock"
ALK,"Alaska Air Group, Inc. Common Stock"
ALL,Allstate Corporation (The) Common Stock
ALLY,Ally Financial Inc. Common Stock
ALSN,"Allison Transmission Holdings, Inc. Common Stock"
ALTG,Alta Equipment Group Inc. Class A Common Stock
ALV,"Autoliv, Inc. Common Stock"
ALX,"Alexander's, Inc. Common Stock"
AM,Antero Midstream Corporation Common Stock
AMBQ,"Ambiq Micro, Inc. Common Stock"
AMC,"AMC Entertainment Holdings, Inc. Class A Common Stock"
AMG,"Affiliated Managers Group, Inc. Common Stock"
AMP,"Ameriprise Financial, Inc. Common Stock"
AMPX,"Amprius Technologies, Inc. Common Stock"
AMPY,Amplify Energy Corp. Common Stock
AMR,"Alpha Metallurgical Resources, Inc. Common Stock"
AMRC,"Ameresco, Inc. Class A Common Stock"
AMT,American Tower Corporation (REIT) Common Stock
AMTB,Amerant Bancorp Inc. Class A Common Stock
AMTM,"Amentum Holdings, Inc. Common Stock"
AMWL,American Well Corporation Class A Common Stock
AN,"AutoNation, Inc. Common Stock"
ANDG,Andersen Group Inc. Class A Common Stock
ANET,"Arista Networks, Inc. Common Stock"
ANF,Abercrombie & Fitch Company Common Stock
ANGX,"Angel Studios, Inc. Class A Common Stock"
ANRO,"Alto Neuroscience, Inc. Common Stock"
ANVS,"Annovis Bio, Inc. Common Stock"
AOMR,"Angel Oak Mortgage REIT, Inc. Common Stock"
AORT,"Artivion, Inc. Common Stock"
AOS,A.O. Smith Corporation Common Stock
APAM,Artisan Partners Asset Management Inc. Class A Common Stock
APD,"Air Products and Chemicals, Inc. Common Stock"
APG,APi Group Corporation Common Stock
APH,Amphenol Corporation Common Stock
APO,"Apollo Global Management, Inc. (New) Common Stock"
AR,Antero Resources Corporation Common Stock
ARDT,"Ardent Health, Inc. Common Stock"
ARE,"Alexandria Real Estate Equities, Inc. Common Stock"
ARES,Ares Management Corporation Class A Common Stock
ARL,"American Realty Investors, Inc. Common Stock"
ARLO,"Arlo Technologies, Inc. Common Stock"
ARMK,Aramark Common Stock
AROC,"Archrock, Inc. Common Stock"
ARW,"Arrow Electronics, Inc. Common Stock"
ASAN,"Asana, Inc. Class A Common Stock"
ASC,Ardmore Shipping Corporation Common Stock
ASH,Ashland Inc. Common Stock
ASIC,Ategrity Specialty Insurance Company Holdings Common Stock
ASIX,AdvanSix Inc. Common Stock 
ASPN,"Aspen Aerogels, Inc. Common Stock"
ASR,"Grupo Aeroportuario del Sureste, S.A. de C.V. Common Stock"
ATEN,"A10 Networks, Inc. Common Stock"
ATI,ATI Inc. Common Stock
ATKR,Atkore Inc. Common Stock
ATMU,Atmus Filtration Technologies Inc. Common Stock
ATO,Atmos Energy Corporation Common Stock
ATR,"AptarGroup, Inc. Common Stock"
AUB,Atlantic Union Bankshares Corporation Common Stock
AVA,Avista Corporation Common Stock
AVB,"AvalonBay Communities, Inc. Common Stock"
AVBC,"Avidia Bancorp, Inc. Common Stock"
AVD,American Vanguard Corporation Common Stock ($0.10 Par Value)
AVEX,AEVEX Corp. Class A Common Stock
AVNS,"Avanos Medical, Inc. Common Stock"
AVNT,Avient Corporation Common Stock
AVTR,"Avantor, Inc. Common Stock"
AVY,Avery Dennison Corporation Common Stock
AWI,Armstrong World Industries Inc Common Stock
AWK,"American Water Works Company, Inc. Common Stock"
AWR,American States Water Company Common Stock
AX,"Axos Financial, Inc. Common Stock"
AXP,American Express Company Common Stock
AXR,AMREP Corporation Common Stock
AXS,Axis Capital Holdings Limited Common Stock
AYI,Acuity Inc. Common Stock
AZO,"AutoZone, Inc. Common Stock"
BA,Boeing Company (The) Common Stock
BAC,Bank of America Corporation Common Stock
BAH,Booz Allen Hamilton Holding Corporation Common Stock
BALL,Ball Corporation Common Stock
BALY,Bally's Corporation Common Stock
BANC,"Banc of California, Inc. Common Stock"
BAP,Credicorp Ltd. Common Stock
BARK,"BARK, Inc. Class A Common Stock"
BAX,Baxter International Inc. Common Stock
BB,BlackBerry Limited Common Stock
BBAI,"BigBear.ai, Inc. Common Stock"
BBBY,"Bed Bath & Beyond, Inc. Common Stock"
BBDC,"Barings BDC, Inc. Common Stock"
BBT,Beacon Financial Corporation Common stock
BBVA,Banco Bilbao Vizcaya Argentaria S.A. Common Stock
BBY,"Best Buy Co., Inc. Common Stock"
BC,Brunswick Corporation Common Stock
BCC,"Boise Cascade, L.L.C. Common Stock"
BCE,"BCE, Inc. Common Stock"
BCO,Brinks Company (The) Common Stock
BCS,Barclays PLC Common Stock
BCSF,"Bain Capital Specialty Finance, Inc. Common Stock"
BDC,Belden Inc Common Stock
BDN,Brandywine Realty Trust Common Stock
BDX,"Becton, Dickinson and Company Common Stock"
BE,Bloom Energy Corporation Class A Common Stock
BEN,"Franklin Resources, Inc. Common Stock"
BETA,"Beta Technologies, Inc. Class A Common Stock"
BF-A,Brown Forman Inc Class A Common Stock
BF-B,Brown Forman Inc Class B Common Stock
BFAM,Bright Horizons Family Solutions Inc. Common Stock
BFH,"Bread Financial Holdings, Inc. Common Stock"
BFLY,"Butterfly Network, Inc. Class A Common Stock"
BFS,"Saul Centers, Inc. Common Stock"
BGS,"B&G Foods, Inc. Common Stock"
BGSF,"BGSF, Inc. Common Stock"
BH,Biglari Holdings Inc. Class B Common Stock
BH-A,Biglari Holdings Inc. Class A Common Stock
BHC,Bausch Health Companies Inc. Common Stock
BHE,"Benchmark Electronics, Inc. Common Stock"
BHR,Braemar Hotels & Resorts Inc. Common Stock
BILL,"BILL Holdings, Inc. Common Stock"
BJ,"BJ's Wholesale Club Holdings, Inc. Common Stock"
BKD,Brookdale Senior Living Inc. Common Stock
BKE,"Buckle, Inc. (The) Common Stock"
BKH,Black Hills Corporation Common Stock
BKKT,"Bakkt, Inc. Class A Common Stock"
BKSY,BlackSky Technology Inc. Class A Common Stock
BKU,"BankUnited, Inc. Common Stock"
BKV,BKV Corporation Common Stock
BLD,TopBuild Corp. Common Stock
BLDR,"Builders FirstSource, Inc. Common Stock"
BLK,"BlackRock, Inc. Common Stock"
BLND,"Blend Labs, Inc. Class A Common Stock"
BMI,"Badger Meter, Inc. Common Stock"
BMNR,"BitMine Immersion Technologies, Inc. Common Stock"
BMO,Bank Of Montreal Common Stock
BNED,"Barnes & Noble Education, Inc Common Stock"
BNL,"Broadstone Net Lease, Inc. Common Stock"
BNY,The Bank of New York Mellon Corporation Common Stock
BOBS,"Bob's Discount Furniture, Inc. Common Stock"
BOC,Boston Omaha Corporation Class A Common Stock
BOH,Bank of Hawaii Corporation Common Stock
BOOT,"Boot Barn Holdings, Inc. Common Stock"
BOW,Bowhead Specialty Holdings Inc. Common Stock
BOX,"Box, Inc. Class A Common Stock"
BP,BP p.l.c. Common Stock
BR,"Broadridge Financial Solutions, Inc. Common Stock"
BRBR,"BellRing Brands, Inc. Common Stock "
BRC,Brady Corporation Common Stock
BRCC,BRC Inc. Class A Common Stock
BRK-A,Berkshire Hathaway Inc. Common Stock
BRK-B,Berkshire Hathaway Inc. New Common Stock
BRO,"Brown & Brown, Inc. Common Stock"
BROS,Dutch Bros Inc. Class A Common Stock
BRSP,"BrightSpire Capital, Inc. Class A Common Stock"
BRT,BRT Apartments Corp. (MD) Common Stock
BRX,Brixmor Property Group Inc. Common Stock
BSX,Boston Scientific Corporation Common Stock
BTGO,"BitGo Holdings, Inc. Class A Common Stock"
BTI,"British American Tobacco  Industries, p.l.c. Common Stock ADR"
BTO,John Hancock Financial Opportunities Fund Common Stock
BTU,Peabody Energy Corporation Common Stock 
BURL,"Burlington Stores, Inc. Common Stock"
BV,"BrightView Holdings, Inc. Common Stock"
BW,"Babcock & Wilcox Enterprises, Inc. Common Stock"
BWA,BorgWarner Inc. Common Stock
BWXT,"BWX Technologies, Inc. Common Stock"
BX,Blackstone Inc. Common Stock
BXC,Bluelinx Holdings Inc. Common Stock
BXDC,Blackstone Digital Infrastructure Trust Inc. Common Stock
BXMT,"Blackstone Mortgage Trust, Inc. Common Stock"
BXP,"BXP, Inc. Common Stock"
BY,"Byline Bancorp, Inc. Common Stock"
BYD,Boyd Gaming Corporation Common Stock
BZH,"Beazer Homes USA, Inc. Common Stock"
C,"Citigroup, Inc. Common Stock"
CABO,"Cable One, Inc. Common Stock"
CACI,"CACI International, Inc. Class A Common Stock"
CAF,Morgan Stanley China A Share Fund Inc. Common Stock
CAG,"ConAgra Brands, Inc. Common Stock"
CAH,"Cardinal Health, Inc. Common Stock"
CAL,"Caleres, Inc. Common Stock"
CALX,"Calix, Inc Common Stock"
CALY,Callaway Golf Company Common Stock
CARR,Carrier Global Corporation Common Stock 
CARS,Cars.com Inc. Common Stock 
CAT,"Caterpillar, Inc. Common Stock"
CATO,Cato Corporation (The) Class A Common Stock
CAVA,"CAVA Group, Inc. Common Stock"
CB,Chubb Limited  Common Stock
CBAN,"Colony Bankcorp, Inc. Common Stock"
CBL,"CBL & Associates Properties, Inc. Common Stock"
CBNA,"Chain Bridge Bancorp, Inc. Class A Common Stock"
CBRE,CBRE Group Inc Common Stock Class A
CBT,Cabot Corporation Common Stock
CBU,"Community Financial System, Inc. Common Stock"
CBZ,"CBIZ, Inc. Common Stock"
CC,Chemours Company (The) Common Stock
CCI,Crown Castle Inc. Common Stock
CCJ,Cameco Corporation Common Stock
CCO,"Clear Channel Outdoor Holdings, Inc. Common Stock"
CCS,"Century Communities, Inc. Common Stock"
CCU,"Compania Cervecerias Unidas, S.A. Common Stock"
CDE,"Coeur Mining, Inc. Common Stock"
CDRE,"Cadre Holdings, Inc. Common Stock"
CE,Celanese Corporation Common Stock
CEE,"The Central and Eastern Europe Fund, Inc. (The) Common Stock"
CF,"CF Industries Holdings, Inc. Common Stock"
CFG,"Citizens Financial Group, Inc. Common Stock"
CFND,C1 Fund Inc. Common Stock
CFR,"Cullen/Frost Bankers, Inc. Common Stock"
CHCT,Community Healthcare Trust Incorporated Common Stock
CHD,"Church & Dwight Company, Inc. Common Stock"
CHGG,"Chegg, Inc. Common Stock"
CHH,"Choice Hotels International, Inc. Common Stock"
CHMI,Cherry Hill Mortgage Investment Corporation Common Stock
CHPT,"ChargePoint Holdings, Inc. Common Stock"
CHWY,"Chewy, Inc. Class A Common Stock"
CI,The Cigna Group Common Stock
CIA,"Citizens, Inc. Class A Common Stock ($1.00 Par)"
CIEN,Ciena Corporation Common Stock
CIF,MFS Intermediate High Income Fund Common Stock
CII,"BlackRock Enhanced Large Cap Core Fund, Inc. Common Stock"
CIM,Chimera Investment Corporation Common Stock
CION,CION Investment Corporation Common Stock
CLB,Core Laboratories Inc. Common Stock
CLH,"Clean Harbors, Inc. Common Stock"
CLPR,Clipper Realty Inc. Common Stock
CLS,"Celestica, Inc. Common Stock"
CLW,Clearwater Paper Corporation Common Stock
CLX,Clorox Company (The) Common Stock
CM,Canadian Imperial Bank of Commerce Common Stock
CMC,Commercial Metals Company Common Stock
CMDB,Costamare Bulkers Holdings Limited Common Stock
CMG,"Chipotle Mexican Grill, Inc. Common Stock"
CMI,Cummins Inc. Common Stock
CMP,Compass Minerals Intl Inc Common Stock
CMRE,Costamare Inc. Common Stock $0.0001 par value
CMS,CMS Energy Corporation Common Stock
CMTG,"Claros Mortgage Trust, Inc. Common Stock"
CMU,MFS Municipal Income Trust Common Stock
CNA,CNA Financial Corporation Common Stock
CNC,Centene Corporation Common Stock
CNI,Canadian National Railway Company Common Stock
CNK,"Cinemark Holdings Inc Cinemark Holdings, Inc. Common Stock"
CNM,"Core & Main, Inc. Class A Common Stock"
CNMD,CONMED Corporation Common Stock
CNNE,"Cannae Holdings, Inc. Common Stock"
CNO,"CNO Financial Group, Inc. Common Stock"
CNP,"CenterPoint Energy, Inc (Holding Co) Common Stock"
CNQ,Canadian Natural Resources Limited Common Stock
CNR,"Core Natural Resources, Inc. Common Stock"
CNS,Cohen & Steers Inc Common Stock
CNX,CNX Resources Corporation Common Stock
COF,Capital One Financial Corporation Common Stock
COHR,Coherent Corp. Common Stock
COLD,"Americold Realty Trust, Inc. Common Stock"
COMP,"Compass, Inc. Class A Common Stock"
CON,"Concentra Group Holdings Parent, Inc. Common Stock"
COOK,"Traeger, Inc. Common Stock"
COP,ConocoPhillips Common Stock
COR,"Cencora, Inc. Common Stock"
COSO,"CoastalSouth Bancshares, Inc. Common Stock"
COTY,Coty Inc. Class A Common Stock
COUR,"Coursera, Inc. Common Stock"
CPA,"Copa Holdings, S.A. Class A Common Stock"
CPAY,"Corpay, Inc. Common Stock"
CPK,Chesapeake Utilities Corporation Common Stock
CPNG,"Coupang, Inc. Class A Common Stock"
CPT,Camden Property Trust Common Stock
CR,Crane Company Common Stock
CRBG,Corebridge Financial Inc. Common Stock
CRC,California Resources Corporation Common Stock
CRCL,"Circle Internet Group, Inc. Class A Common Stock"
CRD-A,Crawford & Company Common Stock
CRD-B,Crawford & Company Common Stock
CRGY,Crescent Energy Company Class A Common Stock
CRI,"Carter's, Inc. Common Stock"
CRK,"Comstock Resources, Inc. Common Stock"
CRL,"Charles River Laboratories International, Inc. Common Stock"
CRM,"Salesforce, Inc. Common Stock"
CRS,Carpenter Technology Corporation Common Stock
CRT,Cross Timbers Royalty Trust Common Stock
CSL,Carlisle Companies Incorporated Common Stock
CSR,D/B/A Centerspace Common Stock
CSV,"Carriage Services, Inc. Common Stock"
CSW,"CSW Industrials, Inc. Common Stock"
CTEV,Claritev Corporation Class A Common Stock
CTO,"CTO Realty Growth, Inc. Common Stock"
CTOS,"Custom Truck One Source, Inc. Common Stock"
CTRE,"CareTrust REIT, Inc. Common Stock"
CTRI,"Centuri Holdings, Inc. Common Stock"
CTS,CTS Corporation Common Stock
CTVA,"Corteva, Inc. Common Stock "
CUBI,"Customers Bancorp, Inc Common Stock"
CURB,Curbline Properties Corp. Common Stock
CURV,Torrid Holdings Inc. Common Stock
CUZ,Cousins Properties Incorporated Common Stock
CVE,Cenovus Energy Inc Common Stock
CVI,CVR Energy Inc. Common Stock
CVLG,"Covenant Logistics Group, Inc. Class A Common Stock"
CVNA,Carvana Co. Class A Common Stock
CVS,CVS Health Corporation Common Stock
CVX,Chevron Corporation Common Stock
CWAN,"Clearwater Analytics Holdings, Inc. Class A Common Stock"
CWEN,"Clearway Energy, Inc. Class C Common Stock"
CWH,"Camping World Holdings, Inc. Class A Common Stock"
CWT,California Water Service Group Common Stock
CXE,MFS High Income Municipal Trust Common Stock
CXH,MFS Investment Grade Municipal Trust Common Stock
CXM,"Sprinklr, Inc. Class A Common Stock"
CXT,"Crane NXT, Co. Common Stock"
CXW,"CoreCivic, Inc. Common Stock"
CYD,China Yuchai International Limited Common Stock
CYH,"Community Health Systems, Inc. Common Stock"
D,"Dominion Energy, Inc. Common Stock"
DAC,Danaos Corporation Common Stock
DAL,"Delta Air Lines, Inc. Common Stock"
DAN,Dana Incorporated Common Stock 
DAR,Darling Ingredients Inc. Common Stock
DB,Deutsche Bank AG Common Stock
DBD,Diebold Nixdorf Incorporated Common stock
DBI,Designer Brands Inc. Class A Common Stock
DCH,Dauch Corporation Common Stock
DCI,"Donaldson Company, Inc. Common Stock"
DCO,Ducommun Incorporated Common Stock
DCOM,"Dime Commercial Bancshares, Inc. Common Stock"
DD,"DuPont de Nemours, Inc. Common Stock"
DDD,3D Systems Corporation Common Stock
DDS,"Dillard's, Inc. Common Stock"
DE,Deere & Company Common Stock
DEA,"Easterly Government Properties, Inc. Common Stock"
DEC,Diversified Energy Company Common Stock
DECK,Deckers Outdoor Corporation Common Stock
DEI,"Douglas Emmett, Inc. Common Stock"
DELL,Dell Technologies Inc. Class C Common Stock 
DEO,Diageo plc Common Stock
DFH,"Dream Finders Homes, Inc. Class A Common Stock"
DFIN,"Donnelley Financial Solutions, Inc. Common Stock "
DG,Dollar General Corporation Common Stock
DGX,Quest Diagnostics Incorporated Common Stock
DHF,BNY Mellon High Yield Strategies Fund Common Stock
DHI,"D.R. Horton, Inc. Common Stock"
DHR,Danaher Corporation Common Stock
DHX,"DHI Group, Inc. Common Stock"
DIN,"Dine Brands Global, Inc. Common Stock"
DINO,HF Sinclair Corporation Common Stock
DIS,Walt Disney Company (The) Common Stock
DK,"Delek US Holdings, Inc. Common Stock"
DKS,Dick's Sporting Goods Inc Common Stock
DLB,Dolby Laboratories Common Stock
DLR,"Digital Realty Trust, Inc. Common Stock"
DLX,Deluxe Corporation Common Stock
DMB,"BNY Mellon Municipal Bond Infrastructure Fund, Inc. Common Stock"
DMO,Western Asset Mortgage Opportunity Fund Inc. Common Stock
DNA,"Ginkgo Bioworks Holdings, Inc. Class A Common Stock"
DNOW,DNOW Inc. Common Stock
DNP,"DNP Select Income Fund, Inc. Common Stock"
DOC,"Healthpeak Properties, Inc. Common Stock"
DOCN,"DigitalOcean Holdings, Inc. Common Stock"
DOCS,"Doximity, Inc. Class A Common Stock"
DOUG,Douglas Elliman Inc. Common Stock
DOV,Dover Corporation Common Stock
DOW,Dow Inc. Common Stock 
DRI,"Darden Restaurants, Inc. Common Stock"
DSM,"BNY Mellon Strategic Municipal Bond Fund, Inc. Common Stock"
DSU,"Blackrock Debt Strategies Fund, Inc. Common Stock"
DSX,Diana Shipping inc. common stock
DT,"Dynatrace, Inc. Common Stock"
DTE,DTE Energy Company Common Stock
DTM,"DT Midstream, Inc. Common Stock "
DUK,Duke Energy Corporation (Holding Company) Common Stock
DV,"DoubleVerify Holdings, Inc. Common Stock"
DVA,DaVita Inc. Common Stock
DVN,Devon Energy Corporation Common Stock
DX,"Dynex Capital, Inc. Common Stock"
DXC,DXC Technology Company Common Stock 
DXYZ,Destiny Tech100 Inc. Common Stock
DY,"Dycom Industries, Inc. Common Stock"
E,ENI S.p.A. Common Stock
EAF,GrafTech International Ltd. Common Stock
EAT,"Brinker International, Inc. Common Stock"
EBF,"Ennis, Inc. Common Stock"
EBS,Emergent BioSolutions Inc. Common Stock
ECG,"Everus Construction Group, Inc. Common Stock"
ECL,Ecolab Inc. Common Stock
ECO,Okeanis Eco Tankers Corp. Common Stock
ECVT,Ecovyst Inc. Common Stock
ED,"Consolidated Edison, Inc. Common Stock"
EDD,"Morgan Stanley Emerging Markets Domestic Debt Fund, Inc. Common Stock"
EE,"Excelerate Energy, Inc. Class A Common Stock"
EEA,"The European Equity Fund, Inc. Common Stock"
EEX,"Emerald Holding, Inc. Common Stock"
EFC,Ellington Financial Inc. Common Stock 
EFOR,"Everforth, Inc. Common Stock"
EFX,"Equifax, Inc. Common Stock"
EG,"Everest Group, Ltd. Common Stock"
EGP,"EastGroup Properties, Inc. Common Stock"
EGY,"VAALCO Energy, Inc.  Common Stock"
EHC,Encompass Health Corporation Common Stock
EHI,Western Asset Global High Income Fund Inc Common Stock
EIC,Eagle Point Income Company Inc. Common Stock
EIG,Employers Holdings Inc Common Stock
EIX,Edison International Common Stock
EL,"Estee Lauder Companies, Inc. (The) Common Stock"
ELAN,Elanco Animal Health Incorporated Common Stock
ELF,"e.l.f. Beauty, Inc. Common Stock"
ELME,Elme Communities Common Stock
ELS,"Equity Lifestyle Properties, Inc. Common Stock"
ELV,"Elevance Health, Inc. Common Stock"
EMBJ,Embraer S.A. Common Stock
EMD,Western Asset Emerging Markets Debt Fund Inc Common Stock
EME,"EMCOR Group, Inc. Common Stock"
EMF,Templeton Emerging Markets Fund Common Stock
EMN,Eastman Chemical Company Common Stock
EMO,ClearBridge Energy Midstream Opportunity Fund Inc. Common Stock
EMR,Emerson Electric Company Common Stock
ENB,Enbridge Inc Common Stock
ENHA,Enhanced Group Inc. Class A Common Stock
ENIC,Enel Chile S.A. American Depositary Shares (Each representing 50 shares of Common Stock)
ENOV,Enovis Corporation Common Stock
ENR,"Energizer Holdings, Inc. Common Stock"
ENS,EnerSys Common Stock
ENVA,"Enova International, Inc. Common Stock"
EOG,"EOG Resources, Inc. Common Stock"
EOS,Eaton Vance Enhance Equity Income Fund II Common Stock
EPAC,Enerpac Tool Group Corp. Common Stock
EPAM,"EPAM Systems, Inc. Common Stock"
EPC,Edgewell Personal Care Company Common Stock
EPD,Enterprise Products Partners L.P. Common Stock
EPR,EPR Properties Common Stock
EPRT,"Essential Properties Realty Trust, Inc. Common Stock"
EQBK,"Equity Bancshares, Inc. Class A Common Stock"
EQH,"Equitable Holdings, Inc. Common Stock"
EQS,"Equus Total Return, Inc. Common Stock"
EQT,EQT Corporation Common Stock
ES,Eversource Energy (D/B/A) Common Stock
ESAB,ESAB Corporation Common Stock
ESE,ESCO Technologies Inc. Common Stock
ESI,Element Solutions Inc. Common Stock
ESRT,"Empire State Realty Trust, Inc. Class A Common Stock"
ESS,"Essex Property Trust, Inc. Common Stock"
ETD,Ethan Allen Interiors Inc. Common Stock
ETR,Entergy Corporation Common Stock
ETSY,"Etsy, Inc. Common Stock"
EVC,Entravision Communications Corporation Common Stock
EVEX,"Eve Holding, Inc. Common Stock"
EVF,Eaton Vance Senior Income Trust Common Stock
EVH,"Evolent Health, Inc Class A Common Stock"
EVMN,"Evommune, Inc. Common Stock"
EVN,Eaton Vance Municipal Income Trust Common Stock
EVR,Evercore Inc. Class A Common Stock
EVTC,"Evertec, Inc. Common Stock"
EW,Edwards Lifesciences Corporation Common Stock
EXP,Eagle Materials Inc Common Stock
EXPD,"Expeditors International of Washington, Inc. Common Stock"
EXR,Extra Space Storage Inc Common Stock
F,Ford Motor Company Common Stock
FAF,First American Corporation (New) Common Stock
FBIN,"Fortune Brands Innovations, Inc. Common Stock"
FBK,FB Financial Corporation Common Stock
FBP,First BanCorp. New Common Stock
FBRT,"Franklin BSP Realty Trust, Inc. Common Stock"
FC,Franklin Covey Company Common Stock
FCF,First Commonwealth Financial Corporation Common Stock
FCN,"FTI Consulting, Inc. Common Stock"
FCPT,"Four Corners Property Trust, Inc. Common Stock"
FDP,"Fresh Del Monte Produce, Inc. Common Stock"
FDS,FactSet Research Systems Inc. Common Stock
FDX,FedEx Corporation Common Stock
FDXF,"FedEx Freight Holding Company, Inc. Common Stock"
FE,FirstEnergy Corp. Common Stock
FERG,Ferguson Enterprises Inc. Common Stock
FET,"Forum Energy Technologies, Inc. Common Stock"
FG,"F&G Annuities & Life, Inc. Common Stock"
FHI,"Federated Hermes, Inc. Common Stock"
FHN,First Horizon Corporation Common Stock
FICO,Fair Isaac Corporation Common Stock
FIG,"Figma, Inc. Class A Common Stock"
FIGS,"FIGS, Inc. Class A Common Stock"
FIS,"Fidelity National Information Services, Inc. Common Stock"
FIX,"Comfort Systems USA, Inc. Common Stock"
FLC,Flaherty & Crumrine Total Return Fund Inc Common Stock
FLG,"Flagstar Bank, N.A. Common Stock"
FLO,"Flowers Foods, Inc. Common Stock"
FLOC,Flowco Holdings Inc. Class A Common Stock
FLR,Fluor Corporation Common Stock
FLS,Flowserve Corporation Common Stock
FMC,FMC Corporation Common Stock
FMX,Fomento Economico Mexicano S.A.B. de C.V. Common Stock
FNB,F.N.B. Corporation Common Stock
FND,"Floor & Decor Holdings, Inc. Common Stock"
FNF,"Fidelity National Financial, Inc. Common Stock"
FOA,Finance of America Companies Inc. Class A Common Stock
FOR,Forestar Group Inc Common Stock 
FOUR,"Shift4 Payments, Inc. Class A Common Stock"
FPI,Farmland Partners Inc. Common Stock
FPS,"Forgent Power Solutions, Inc. Class A Common Stock"
FR,"First Industrial Realty Trust, Inc. Common Stock"
FRA,Blackrock Floating Rate Income Strategies Fund Inc  Common Stock
FRT,Federal Realty Investment Trust Common Stock
FSCO,FS Credit Opportunities Corp. Common Stock
FSK,FS KKR Capital Corp. Common Stock
FSS,Federal Signal Corporation Common Stock
FT,Franklin Universal Trust Common Stock
FTHY,First Trust High Yield Opportunities 2027 Term Fund Common Stock
FTK,"Flotek Industries, Inc. Common Stock"
FTV,Fortive Corporation Common Stock 
FTW,Presidio Production Company Class A Common Stock
FUBO,FuboTV Inc. Class A Common Stock
FUL,H. B. Fuller Company Common Stock
FUN,Six Flags Entertainment Corporation Common Stock New
FVR,"FrontView REIT, Inc. Common Stock"
G,Genpact Limited Common Stock
GAB,"Gabelli Equity Trust, Inc. (The) Common Stock"
GAM,"General American Investors, Inc. Common Stock"
GAP,"Gap, Inc. (The) Common Stock"
GATX,GATX Corporation Common Stock
GBCI,"Glacier Bancorp, Inc. Common Stock"
GBTG,"Global Business Travel Group, Inc. Class A Common Stock"
GBX,"Greenbrier Companies, Inc. (The) Common Stock"
GCO,Genesco Inc. Common Stock
GCTS,"GCT Semiconductor Holding, Inc. Common Stock"
GCV,"Gabelli Convertible and Income Securities Fund, Inc. (The) Common Stock"
GD,General Dynamics Corporation Common Stock
GDDY,GoDaddy Inc. Class A Common Stock
GDO,Western Asset Global Corporate Opportunity Fund Inc. Common Stock
GDOT,"Green Dot Corporation Class A Common Stock, $0.001 par value"
GE,GE Aerospace Common Stock
GEF,Greif Inc. Class A Common Stock
GEF-B,"Greif, Inc. Corporation Class B Common Stock"
GETY,"Getty Images Holdings, Inc. Class A Common Stock"
GEV,GE Vernova Inc. Common Stock
GF,"New Germany Fund, Inc. (The) Common Stock"
GFF,Griffon Corporation Common Stock
GGB,Gerdau S.A. Common Stock
GGG,Graco Inc. Common Stock
